{
  "dataset": {
    "mode": "widescreen_gaming_quiz",
    "title": "50 GAMING QUESTIONS CHALLENGE",
    "language": "ru",
    "guessing_duration_sec": 6.0,
    "reveal_hold_duration_sec": 3.0,
    "bgm_track_path": null,
    "bgm_ducking_volume": 0.18,
    "bgm_base_volume": 0.3,
    "ambient_background_video": null,
    "intro": {
      "hook_tts": "50 игровых вопросов. 5 уникальных раундов. Сможешь ли ты дойти до ранга God Tier? Раунд один начинается прямо сейчас!",
      "duration_sec": 8.0,
      "challenge_title": "50 GAMING QUESTIONS CHALLENGE"
    },
    "outro": {
      "duration_sec": 15.0,
      "outro_tts": "Напиши свой итоговый балл в комментариях под этим видео и подпишись на канал, чтобы не пропустить вторую часть!",
      "call_to_action": "НАПИШИ СВОЙ СЧЕТ В КОММЕНТАРИЯХ & ПОДПИШИСЬ!",
      "score_tiers": [
        {
          "tier_name": "Noob",
          "min_score": 0,
          "max_score": 20,
          "badge_color": "#94A3B8"
        },
        {
          "tier_name": "Gamer",
          "min_score": 21,
          "max_score": 35,
          "badge_color": "#3B82F6"
        },
        {
          "tier_name": "Pro",
          "min_score": 36,
          "max_score": 45,
          "badge_color": "#8B5CF6"
        },
        {
          "tier_name": "God Tier",
          "min_score": 46,
          "max_score": 50,
          "badge_color": "#F59E0B"
        }
      ]
    },
    "rounds": [
      {
        "round_number": 1,
        "round_title": "РАУНД 01: СКРИНШОТЫ ИГР",
        "asset_mode": "screenshot",
        "pass_rate_statistic": "94% ИГРОКОВ ПРОХОДЯТ ЭТОТ РАУНД",
        "badge_theme_color": "#58A6FF",
        "splash_duration_sec": 4.0,
        "questions": [
          {
            "id": "1dd63a8ebedb",
            "item_index": 1,
            "global_question_number": 1,
            "prompt_text": "Угадайте игру по скриншоту",
            "answer_text": "GRAND THEFT AUTO V",
            "asset_url": null,
            "asset_path": "images/test_gta.png",
            "asset_search_query": "GTA V gameplay screenshot Los Santos",
            "apply_procedural_mask": true,
            "is_approved": false,
            "difficulty_tag": null,
            "audio_cue_duration_sec": 4.0
          },
          {
            "id": "31b16a3247e8",
            "item_index": 2,
            "global_question_number": 2,
            "prompt_text": "Угадайте игру по скриншоту",
            "answer_text": "MINECRAFT",
            "asset_url": null,
            "asset_path": null,
            "asset_search_query": "Minecraft survival house screenshot",
            "apply_procedural_mask": true,
            "is_approved": false,
            "difficulty_tag": null,
            "audio_cue_duration_sec": 4.0
          },
          {
            "id": "957e852ede04",
            "item_index": 3,
            "global_question_number": 3,
            "prompt_text": "Угадайте игру по скриншоту",
            "answer_text": "THE ELDER SCROLLS V: SKYRIM",
            "asset_url": null,
            "asset_path": null,
            "asset_search_query": "Skyrim Bleak Falls Barrow screenshot",
            "apply_procedural_mask": true,
            "is_approved": false,
            "difficulty_tag": null,
            "audio_cue_duration_sec": 4.0
          },
          {
            "id": "a3ebef3bea9d",
            "item_index": 4,
            "global_question_number": 4,
            "prompt_text": "Угадайте игру по скриншоту",
            "answer_text": "FORTNITE",
            "asset_url": null,
            "asset_path": null,
            "asset_search_query": "Fortnite battle royale gameplay screenshot",
            "apply_procedural_mask": true,
            "is_approved": false,
            "difficulty_tag": null,
            "audio_cue_duration_sec": 4.0
          },
          {
            "id": "8330d345f452",
            "item_index": 5,
            "global_question_number": 5,
            "prompt_text": "Угадайте игру по скриншоту",
            "answer_text": "THE WITCHER 3: WILD HUNT",
            "asset_url": null,
            "asset_path": null,
            "asset_search_query": "Witcher 3 White Orchard landscape screenshot",
            "apply_procedural_mask": true,
            "is_approved": false,
            "difficulty_tag": null,
            "audio_cue_duration_sec": 4.0
          },
          {
            "id": "ce7f89fffa58",
            "item_index": 6,
            "global_question_number": 6,
            "prompt_text": "Угадайте игру по скриншоту",
            "answer_text": "DOOM ETERNAL",
            "asset_url": null,
            "asset_path": null,
            "asset_search_query": "Doom Eternal slayer combat screenshot",
            "apply_procedural_mask": true,
            "is_approved": false,
            "difficulty_tag": null,
            "audio_cue_duration_sec": 4.0
          },
          {
            "id": "9a8edd6c680d",
            "item_index": 7,
            "global_question_number": 7,
            "prompt_text": "Угадайте игру по скриншоту",
            "answer_text": "PORTAL 2",
            "asset_url": null,
            "asset_path": null,
            "asset_search_query": "Portal 2 aperture science test chamber",
            "apply_procedural_mask": true,
            "is_approved": false,
            "difficulty_tag": null,
            "audio_cue_duration_sec": 4.0
          },
          {
            "id": "2ea2758a7769",
            "item_index": 8,
            "global_question_number": 8,
            "prompt_text": "Угадайте игру по скриншоту",
            "answer_text": "CYBERPUNK 2077",
            "asset_url": null,
            "asset_path": null,
            "asset_search_query": "Cyberpunk 2077 Night City neon street",
            "apply_procedural_mask": true,
            "is_approved": false,
            "difficulty_tag": null,
            "audio_cue_duration_sec": 4.0
          },
          {
            "id": "eb420420d5e1",
            "item_index": 9,
            "global_question_number": 9,
            "prompt_text": "Угадайте игру по скриншоту",
            "answer_text": "HALF-LIFE 2",
            "asset_url": null,
            "asset_path": null,
            "asset_search_query": "Half-Life 2 City 17 trainstation screenshot",
            "apply_procedural_mask": true,
            "is_approved": false,
            "difficulty_tag": null,
            "audio_cue_duration_sec": 4.0
          },
          {
            "id": "3735445ad847",
            "item_index": 10,
            "global_question_number": 10,
            "prompt_text": "Угадайте игру по скриншоту",
            "answer_text": "ELDEN RING",
            "asset_url": null,
            "asset_path": null,
            "asset_search_query": "Elden Ring Erdtree Limgrave panorama",
            "apply_procedural_mask": true,
            "is_approved": false,
            "difficulty_tag": null,
            "audio_cue_duration_sec": 4.0
          }
        ]
      },
      {
        "round_number": 2,
        "round_title": "РАУНД 02: ЗВУКИ ОРУЖИЯ И ПРЕДМЕТОВ",
        "asset_mode": "audio_sfx",
        "pass_rate_statistic": "78% ИГРОКОВ ПРОХОДЯТ ЭТОТ РАУНД",
        "badge_theme_color": "#00E5FF",
        "splash_duration_sec": 4.0,
        "questions": [
          {
            "id": "0a0d939c5207",
            "item_index": 1,
            "global_question_number": 11,
            "prompt_text": "Угадайте оружие или предмет по звуку",
            "answer_text": "AWP (CS:GO / CS2)",
            "asset_url": null,
            "asset_path": null,
            "asset_search_query": "CS AWP sniper rifle gunshot sound",
            "apply_procedural_mask": true,
            "is_approved": false,
            "difficulty_tag": null,
            "audio_cue_duration_sec": 4.0
          },
          {
            "id": "92e11cac2326",
            "item_index": 2,
            "global_question_number": 12,
            "prompt_text": "Угадайте оружие или предмет по звуку",
            "answer_text": "AK-47 (COUNTER-STRIKE)",
            "asset_url": null,
            "asset_path": null,
            "asset_search_query": "CS AK-47 assault rifle gunshot sound",
            "apply_procedural_mask": true,
            "is_approved": false,
            "difficulty_tag": null,
            "audio_cue_duration_sec": 4.0
          },
          {
            "id": "fea810a646e0",
            "item_index": 3,
            "global_question_number": 13,
            "prompt_text": "Угадайте оружие или предмет по звуку",
            "answer_text": "MINECRAFT (ЗВУК ЕДЫ)",
            "asset_url": null,
            "asset_path": null,
            "asset_search_query": "Minecraft eating apple food sound",
            "apply_procedural_mask": true,
            "is_approved": false,
            "difficulty_tag": null,
            "audio_cue_duration_sec": 4.0
          },
          {
            "id": "6fd8195d2567",
            "item_index": 4,
            "global_question_number": 14,
            "prompt_text": "Угадайте оружие или предмет по звуку",
            "answer_text": "HALF-LIFE (АПТЕЧКА)",
            "asset_url": null,
            "asset_path": null,
            "asset_search_query": "Half-Life wall health station medkit sound",
            "apply_procedural_mask": true,
            "is_approved": false,
            "difficulty_tag": null,
            "audio_cue_duration_sec": 4.0
          },
          {
            "id": "941b0b71e7bd",
            "item_index": 5,
            "global_question_number": 15,
            "prompt_text": "Угадайте оружие или предмет по звуку",
            "answer_text": "DARK SOULS (YOU DIED)",
            "asset_url": null,
            "asset_path": null,
            "asset_search_query": "Dark Souls death sound you died chime",
            "apply_procedural_mask": true,
            "is_approved": false,
            "difficulty_tag": null,
            "audio_cue_duration_sec": 4.0